number,value,datetime_start,datetime_complete,duration,params_activation,params_hidden_layers,params_hidden_units,params_learning_rate,user_attrs_compute_time_sec,user_attrs_err_k,user_attrs_err_u,system_attrs_tpe:relative_params:0,state
0,0.05457699624546126,2026-09-20 08:52:38.888118,2026-09-20 08:53:53.131112,0 days 00:01:14.242994,Tanh,2,15,0.01,74.23283982276917,0.09151494439172426,0.017639048099198255,,COMPLETE
1,0.06820994108433058,2026-09-20 08:53:53.131753,2026-09-20 08:55:18.232208,0 days 00:01:25.100455,Tanh,2,15,0.0001,85.09466981887817,0.12654671089354863,0.009873171275112535,,COMPLETE
2,0.006494340359377906,2026-09-20 08:55:18.232880,2026-09-20 08:56:40.452392,0 days 00:01:22.219512,Tanh,2,104,0.001,82.21355867385864,0.0005581269897004871,0.012430553729055325,,COMPLETE
3,0.005614167676590781,2026-09-20 08:56:40.453001,2026-09-20 08:58:03.300215,0 days 00:01:22.847214,Sigmoid,2,90,0.001,82.84145665168762,0.000541494116056712,0.01068684123712485,,COMPLETE
4,0.38552661739325456,2026-09-20 08:58:03.300803,2026-09-20 08:59:17.530512,0 days 00:01:14.229709,Tanh,1,15,0.01,74.223388671875,0.6835678943745246,0.08748534041198454,,COMPLETE
5,0.002080434077461247,2026-09-20 08:59:17.531793,2026-09-20 09:00:48.261917,0 days 00:01:30.730124,Tanh,3,104,0.001,90.7222580909729,0.00030675461716391357,0.0038541135377585804,,COMPLETE
6,0.0046378592343082545,2026-09-20 09:00:48.262634,2026-09-20 09:02:10.214159,0 days 00:01:21.951525,Tanh,2,90,0.001,81.94390153884888,0.0006058742130927317,0.008669844255523777,,COMPLETE
7,0.20844304903265257,2026-09-20 09:02:10.214864,2026-09-20 09:03:37.091481,0 days 00:01:26.876617,Sigmoid,2,15,0.0001,86.86917495727539,0.3801722868383199,0.036713811226985256,,COMPLETE
8,0.38552661739325456,2026-09-20 09:03:37.092178,2026-09-20 09:04:50.401112,0 days 00:01:13.308934,Tanh,1,15,0.01,73.30235815048218,0.6835678943745246,0.08748534041198454,,COMPLETE
9,0.0686750744755059,2026-09-20 09:04:50.401796,2026-09-20 09:06:13.896175,0 days 00:01:23.494379,Sigmoid,2,90,0.0001,83.48654246330261,0.1232967081121081,0.014053440838903693,,COMPLETE
10,0.0036358918959529295,2026-09-20 09:06:13.897057,2026-09-20 09:07:47.121221,0 days 00:01:33.224164,Tanh,3,104,0.0001,93.2161226272583,0.0009985925214625556,0.006273191270443303,"{""activation"": ""Tanh"", ""hidden_layers"": 3, ""hidden_units"": 104, ""learning_rate"": 0.0001}",COMPLETE
11,0.0036358918959529295,2026-09-20 09:07:47.121750,2026-09-20 09:09:14.461543,0 days 00:01:27.339793,Tanh,3,104,0.0001,87.33137893676758,0.0009985925214625556,0.006273191270443303,"{""activation"": ""Tanh"", ""hidden_layers"": 3, ""hidden_units"": 104, ""learning_rate"": 0.0001}",COMPLETE
12,0.11870101526298571,2026-09-20 09:09:14.462294,2026-09-20 09:10:48.334823,0 days 00:01:33.872529,Sigmoid,3,104,0.001,93.86468434333801,0.2147336380408288,0.022668392485142623,"{""activation"": ""Sigmoid"", ""hidden_layers"": 3, ""hidden_units"": 104, ""learning_rate"": 0.001}",COMPLETE
13,0.014232738457118787,2026-09-20 09:10:48.335408,2026-09-20 09:12:20.747696,0 days 00:01:32.412288,Tanh,3,15,0.001,92.40297198295593,0.021451069251701604,0.00701440766253597,"{""activation"": ""Tanh"", ""hidden_layers"": 3, ""hidden_units"": 15, ""learning_rate"": 0.001}",COMPLETE
14,0.021558323666782266,2026-09-20 09:12:20.748590,2026-09-20 09:12:43.000428,0 days 00:00:22.251838,Tanh,3,104,0.01,22.244113206863403,0.027923733968017894,0.015192913365546639,"{""activation"": ""Tanh"", ""hidden_layers"": 3, ""hidden_units"": 104, ""learning_rate"": 0.01}",COMPLETE
15,1.7938876411966584,2026-09-20 09:12:43.001086,2026-09-20 09:13:59.317599,0 days 00:01:16.316513,Sine,1,104,0.001,76.30909156799316,3.521236343398944,0.06653893899437292,"{""activation"": ""Sine"", ""hidden_layers"": 1, ""hidden_units"": 104, ""learning_rate"": 0.001}",COMPLETE
16,0.0025751151653438443,2026-09-20 09:13:59.318233,2026-09-20 09:15:28.291113,0 days 00:01:28.972880,Sine,3,90,0.0001,88.96523761749268,0.0007913611207787388,0.00435886920990895,"{""activation"": ""Sine"", ""hidden_layers"": 3, ""hidden_units"": 90, ""learning_rate"": 0.0001}",COMPLETE
17,0.0025751151653438443,2026-09-20 09:15:28.291833,2026-09-20 09:16:58.807182,0 days 00:01:30.515349,Sine,3,90,0.0001,90.50717544555664,0.0007913611207787388,0.00435886920990895,"{""activation"": ""Sine"", ""hidden_layers"": 3, ""hidden_units"": 90, ""learning_rate"": 0.0001}",COMPLETE
18,0.061298626590192765,2026-09-20 09:16:58.807838,2026-09-20 09:18:29.661706,0 days 00:01:30.853868,Sigmoid,3,90,0.01,90.8453094959259,0.11495610883189604,0.007641144348489495,"{""activation"": ""Sigmoid"", ""hidden_layers"": 3, ""hidden_units"": 90, ""learning_rate"": 0.01}",COMPLETE
19,0.0013199545212951597,2026-09-20 09:18:29.662347,2026-09-20 09:19:59.527371,0 days 00:01:29.865024,Sine,3,90,0.001,89.85725212097168,0.000518531734903517,0.0021213773076868025,"{""activation"": ""Sine"", ""hidden_layers"": 3, ""hidden_units"": 90, ""learning_rate"": 0.001}",COMPLETE
20,0.0013199545212951597,2026-09-20 09:19:59.527947,2026-09-20 09:21:24.614556,0 days 00:01:25.086609,Sine,3,90,0.001,85.07901215553284,0.000518531734903517,0.0021213773076868025,"{""activation"": ""Sine"", ""hidden_layers"": 3, ""hidden_units"": 90, ""learning_rate"": 0.001}",COMPLETE
21,0.0013199545212951597,2026-09-20 09:21:24.615152,2026-09-20 09:22:51.158174,0 days 00:01:26.543022,Sine,3,90,0.001,86.53586912155151,0.000518531734903517,0.0021213773076868025,"{""activation"": ""Sine"", ""hidden_layers"": 3, ""hidden_units"": 90, ""learning_rate"": 0.001}",COMPLETE
22,0.0013199545212951597,2026-09-20 09:22:51.158814,2026-09-20 09:24:25.569290,0 days 00:01:34.410476,Sine,3,90,0.001,94.39954853057861,0.000518531734903517,0.0021213773076868025,"{""activation"": ""Sine"", ""hidden_layers"": 3, ""hidden_units"": 90, ""learning_rate"": 0.001}",COMPLETE
23,1.9211142777512695,2026-09-20 09:24:25.570112,2026-09-20 09:25:45.508597,0 days 00:01:19.938485,Sine,1,90,0.001,79.9309389591217,3.73057643114481,0.11165212435772903,"{""activation"": ""Sine"", ""hidden_layers"": 1, ""hidden_units"": 90, ""learning_rate"": 0.001}",COMPLETE
24,0.010641897686946358,2026-09-20 09:25:45.509271,2026-09-20 09:27:20.140126,0 days 00:01:34.630855,Sine,3,15,0.001,94.62120985984802,0.011203530598566587,0.010080264775326132,"{""activation"": ""Sine"", ""hidden_layers"": 3, ""hidden_units"": 15, ""learning_rate"": 0.001}",COMPLETE
25,0.01769800727142314,2026-09-20 09:27:20.140784,2026-09-20 09:28:41.759941,0 days 00:01:21.619157,Sine,2,90,0.01,81.61128306388855,0.02555518510245694,0.00984082944038934,"{""activation"": ""Sine"", ""hidden_layers"": 2, ""hidden_units"": 90, ""learning_rate"": 0.01}",COMPLETE
26,0.06574741394818971,2026-09-20 09:28:41.760701,2026-09-20 09:30:17.926219,0 days 00:01:36.165518,Sigmoid,3,90,0.001,96.15747308731079,0.11681536546955643,0.014679462426822994,"{""activation"": ""Sigmoid"", ""hidden_layers"": 3, ""hidden_units"": 90, ""learning_rate"": 0.001}",COMPLETE
27,0.007474092723731239,2026-09-20 09:30:17.926973,2026-09-20 09:31:42.310330,0 days 00:01:24.383357,Sine,2,90,0.001,84.37288546562195,0.0011601459423361995,0.013788039505126278,"{""activation"": ""Sine"", ""hidden_layers"": 2, ""hidden_units"": 90, ""learning_rate"": 0.001}",COMPLETE
28,0.009335771575405804,2026-09-20 09:31:42.311411,2026-09-20 09:33:17.250259,0 days 00:01:34.938848,Sine,3,90,0.01,94.92943692207336,0.012629507271830756,0.006042035878980852,"{""activation"": ""Sine"", ""hidden_layers"": 3, ""hidden_units"": 90, ""learning_rate"": 0.01}",COMPLETE
29,0.004015822090450641,2026-09-20 09:33:17.250981,2026-09-20 09:35:09.451787,0 days 00:01:52.200806,Tanh,3,90,0.001,112.19171404838562,0.0005312904511525651,0.0075003537297487185,"{""activation"": ""Tanh"", ""hidden_layers"": 3, ""hidden_units"": 90, ""learning_rate"": 0.001}",COMPLETE
30,0.0013199545212951597,2026-09-20 09:35:09.452498,2026-09-20 09:36:47.586142,0 days 00:01:38.133644,Sine,3,90,0.001,98.12508702278137,0.000518531734903517,0.0021213773076868025,"{""activation"": ""Sine"", ""hidden_layers"": 3, ""hidden_units"": 90, ""learning_rate"": 0.001}",COMPLETE
31,0.0013199545212951597,2026-09-20 09:36:47.586828,2026-09-20 09:38:55.871733,0 days 00:02:08.284905,Sine,3,90,0.001,128.27170300483704,0.000518531734903517,0.0021213773076868025,"{""activation"": ""Sine"", ""hidden_layers"": 3, ""hidden_units"": 90, ""learning_rate"": 0.001}",COMPLETE
32,0.0022614811210457378,2026-09-20 09:38:55.872986,2026-09-20 09:40:36.359416,0 days 00:01:40.486430,Sine,3,104,0.001,100.47694945335388,0.0016146459644719988,0.002908316277619477,"{""activation"": ""Sine"", ""hidden_layers"": 3, ""hidden_units"": 104, ""learning_rate"": 0.001}",COMPLETE
33,0.0013199545212951597,2026-09-20 09:40:36.360250,2026-09-20 09:42:18.971704,0 days 00:01:42.611454,Sine,3,90,0.001,102.60241842269897,0.000518531734903517,0.0021213773076868025,"{""activation"": ""Sine"", ""hidden_layers"": 3, ""hidden_units"": 90, ""learning_rate"": 0.001}",COMPLETE
34,0.023513229776725014,2026-09-20 09:42:18.972342,2026-09-20 09:43:40.039563,0 days 00:01:21.067221,Sigmoid,1,90,0.001,81.05909585952759,0.014644180626471433,0.0323822789269786,"{""activation"": ""Sigmoid"", ""hidden_layers"": 1, ""hidden_units"": 90, ""learning_rate"": 0.001}",COMPLETE
35,0.8990017977179205,2026-09-20 09:43:40.040088,2026-09-20 09:45:01.255632,0 days 00:01:21.215544,Sine,1,90,0.01,81.20783543586731,1.711602713840231,0.08640088159561016,"{""activation"": ""Sine"", ""hidden_layers"": 1, ""hidden_units"": 90, ""learning_rate"": 0.01}",COMPLETE
36,0.006033983641784686,2026-09-20 09:45:01.256310,2026-09-20 09:46:21.378332,0 days 00:01:20.122022,Sine,2,104,0.0001,80.11215233802795,0.000697766731103373,0.011370200552465999,"{""activation"": ""Sine"", ""hidden_layers"": 2, ""hidden_units"": 104, ""learning_rate"": 0.0001}",COMPLETE
37,0.18200163436248315,2026-09-20 09:46:21.379028,2026-09-20 09:47:46.174643,0 days 00:01:24.795615,Sigmoid,1,104,0.01,84.78866863250732,0.3411228335894522,0.02288043513551406,"{""activation"": ""Sigmoid"", ""hidden_layers"": 1, ""hidden_units"": 104, ""learning_rate"": 0.01}",COMPLETE
38,0.0013199545212951597,2026-09-20 09:47:46.175214,2026-09-20 09:49:22.138632,0 days 00:01:35.963418,Sine,3,90,0.001,95.95592379570007,0.000518531734903517,0.0021213773076868025,"{""activation"": ""Sine"", ""hidden_layers"": 3, ""hidden_units"": 90, ""learning_rate"": 0.001}",COMPLETE
39,0.8411786477043828,2026-09-20 09:49:22.139276,2026-09-20 09:50:34.325990,0 days 00:01:12.186714,Sine,1,15,0.0001,72.17995572090149,1.2941485409530848,0.38820875445568065,"{""activation"": ""Sine"", ""hidden_layers"": 1, ""hidden_units"": 15, ""learning_rate"": 0.0001}",COMPLETE
40,0.7594411859331507,2026-09-20 09:50:34.326628,2026-09-20 09:51:27.618586,0 days 00:00:53.291958,Sine,1,15,0.001,53.28481149673462,1.232590794347371,0.2862915775189302,"{""activation"": ""Sine"", ""hidden_layers"": 1, ""hidden_units"": 15, ""learning_rate"": 0.001}",COMPLETE
41,0.0013199545212951597,2026-09-20 09:51:27.619258,2026-09-20 09:53:02.904856,0 days 00:01:35.285598,Sine,3,90,0.001,95.27720403671265,0.000518531734903517,0.0021213773076868025,"{""activation"": ""Sine"", ""hidden_layers"": 3, ""hidden_units"": 90, ""learning_rate"": 0.001}",COMPLETE
42,0.0013199545212951597,2026-09-20 09:53:02.905623,2026-09-20 09:54:39.136644,0 days 00:01:36.231021,Sine,3,90,0.001,96.22048950195312,0.000518531734903517,0.0021213773076868025,"{""activation"": ""Sine"", ""hidden_layers"": 3, ""hidden_units"": 90, ""learning_rate"": 0.001}",COMPLETE
43,0.006272235383387222,2026-09-20 09:54:39.137458,2026-09-20 09:56:14.640555,0 days 00:01:35.503097,Sine,3,15,0.01,95.49198961257935,0.00660964085526507,0.005934829911509375,"{""activation"": ""Sine"", ""hidden_layers"": 3, ""hidden_units"": 15, ""learning_rate"": 0.01}",COMPLETE
44,0.0013199545212951597,2026-09-20 09:56:14.641453,2026-09-20 09:57:54.652581,0 days 00:01:40.011128,Sine,3,90,0.001,100.00392270088196,0.000518531734903517,0.0021213773076868025,"{""activation"": ""Sine"", ""hidden_layers"": 3, ""hidden_units"": 90, ""learning_rate"": 0.001}",COMPLETE
45,0.44947914495412017,2026-09-20 09:57:54.653137,2026-09-20 09:59:28.093585,0 days 00:01:33.440448,Sigmoid,3,15,0.001,93.43227934837341,0.8829092435852295,0.01604904632301084,"{""activation"": ""Sigmoid"", ""hidden_layers"": 3, ""hidden_units"": 15, ""learning_rate"": 0.001}",COMPLETE
46,0.004230016504695509,2026-09-20 09:59:28.094348,2026-09-20 10:00:59.238008,0 days 00:01:31.143660,Tanh,3,90,0.0001,91.13609528541565,0.0006984147414834372,0.00776161826790758,"{""activation"": ""Tanh"", ""hidden_layers"": 3, ""hidden_units"": 90, ""learning_rate"": 0.0001}",COMPLETE
47,0.07175495650233862,2026-09-20 10:00:59.238528,2026-09-20 10:02:23.763544,0 days 00:01:24.525016,Sine,2,15,0.001,84.51766324043274,0.10866915247897364,0.03484076052570359,"{""activation"": ""Sine"", ""hidden_layers"": 2, ""hidden_units"": 15, ""learning_rate"": 0.001}",COMPLETE
48,0.01294751804110555,2026-09-20 10:02:23.764220,2026-09-20 10:03:42.055165,0 days 00:01:18.290945,Tanh,1,90,0.001,78.28388524055481,0.004105083760633867,0.02178995232157723,"{""activation"": ""Tanh"", ""hidden_layers"": 1, ""hidden_units"": 90, ""learning_rate"": 0.001}",COMPLETE
49,0.7094200984193925,2026-09-20 10:03:42.055838,2026-09-20 10:04:07.312635,0 days 00:00:25.256797,Sine,3,104,0.01,25.249600648880005,1.3971948102841998,0.0216453865545852,"{""activation"": ""Sine"", ""hidden_layers"": 3, ""hidden_units"": 104, ""learning_rate"": 0.01}",COMPLETE
